{"capabilities":{"cleanup_appledouble":true,"install_apps":false,"install_portmaster":false,"install_ports":true,"inventory_apps":false,"inventory_ports":true,"leftovers":true,"manage_apps":false,"manage_artwork":false,"manage_frontend":false,"manage_images":false,"manage_portmaster":false,"manage_ports":true,"repair_runtimes":true,"scan_script_images":false,"trash":true,"update_portmaster":false},"config_version":"1.0.0","display":{"default_height":720,"default_width":1280},"display_name":"UnofficialOS","environment_scopes":["love_ui"],"format":"jenny92.appmanager-config","frontend":{"control_source":null,"core_executable":"PortMaster.sh","core_launcher_source":null,"empty_tasksetter":false,"frontend_executable":null,"install_map":[],"kind":"core-internal","management":"system","names":[],"primary":"PortMaster.sh","remove_core_launcher":false},"health":[{"kind":"required_file","path":"{portmaster_core}/control.txt"},{"kind":"one_of_files","paths":["{portmaster_core}/pugwash","{portmaster_core}/harbourmaster"]},{"kind":"executable_file","path":"{portmaster_core}/PortMaster.sh"},{"archive":"{portmaster_core}/pylibs.zip","directory":"{portmaster_core}/pylibs","kind":"archive_or_nonempty_directory"}],"input":{"analog_sticks":2,"tty":"/dev/tty0"},"libraries":{"groups":{"system_sdl2":{"candidates":["/lib","/lib64","/usr/lib","/usr/lib64","/lib/aarch64-linux-gnu","/usr/lib/aarch64-linux-gnu"],"required_sonames":["libSDL2-2.0.so.0","libSDL2_image-2.0.so.0","libSDL2_mixer-2.0.so.0","libSDL2_ttf-2.0.so.0"]}}},"locations":[{"formats":["port"],"id":"ports-scripts","kind":"port_scripts","path":"scripts","priority":100,"roles":["inventory","install","manage","trash","trash_restore","cleanup_apple_double"]},{"formats":["port"],"id":"ports-data","kind":"port_data","path":"game_data","priority":100,"roles":["inventory","install","manage","trash","trash_restore","cleanup_apple_double"]}],"paths":{"frontend":{"strategy":"platform_core"},"game_data":{"candidates":["/storage/roms/ports","/roms/ports"],"expected_type":"directory","strategy":"first_existing"},"launcher_directory":{"of":"game_data","strategy":"parent"},"portmaster_core":{"base":"game_data","strategy":"relative_to","suffix":"PortMaster"},"scripts":{"strategy":"launcher_dir"}},"platform_id":"unofficialos","preserved_dirs":["libs","config","themes","logs","cache"],"python":{"imports":["sys","encodings","zipfile","hashlib"],"mode":"system"},"required_adapters":["predicate.v1","path.v1","frontend.v1","library.v1","python.v1"],"schema_version":1,"source_route":"system","support":{"device_class":"official-untested","target_confirmation":"detected"}}
