{"capabilities":{"cleanup_appledouble":true,"install_apps":false,"install_portmaster":true,"install_ports":true,"inventory_apps":false,"inventory_ports":true,"leftovers":true,"manage_apps":false,"manage_artwork":false,"manage_frontend":true,"manage_images":false,"manage_portmaster":true,"manage_ports":true,"repair_runtimes":true,"scan_script_images":false,"trash":true,"update_portmaster":true},"config_version":"1.0.0","display":{"default_height":720,"default_width":960},"display_name":"Generic PortMaster device","environment_scopes":["love_ui"],"format":"jenny92.appmanager-config","frontend":{"control_source":null,"core_executable":"PortMaster.sh","core_launcher_source":null,"empty_tasksetter":false,"frontend_executable":"PortMaster.sh","install_map":[{"executable":true,"source":"PortMaster.sh","target":"PortMaster.sh"}],"kind":"script-internal","management":"app","names":["PortMaster.sh"],"primary":"PortMaster.sh","remove_core_launcher":false},"health":[{"kind":"required_file","path":"{portmaster_core}/control.txt"},{"kind":"one_of_files","paths":["{portmaster_core}/pugwash","{portmaster_core}/harbourmaster"]},{"archive":"{portmaster_core}/pylibs.zip","directory":"{portmaster_core}/pylibs","kind":"archive_or_nonempty_directory"}],"input":{"analog_sticks":2,"tty":"/dev/tty0"},"libraries":{"groups":{"gles":{"candidates":["/usr/lib","/lib"],"required_sonames":["libGLESv2.so"]},"system_sdl2":{"candidates":["/usr/lib","/lib"],"required_sonames":["libSDL2-2.0.so.0","libSDL2_image-2.0.so.0","libSDL2_mixer-2.0.so.0","libSDL2_ttf-2.0.so.0"]}}},"locations":[{"formats":["port"],"id":"ports-scripts","kind":"port_scripts","path":"scripts","priority":100,"roles":["inventory","install","manage","trash","trash_restore","cleanup_apple_double"]},{"formats":["port"],"id":"ports-data","kind":"port_data","path":"game_data","priority":100,"roles":["inventory","install","manage","trash","trash_restore","cleanup_apple_double"]}],"paths":{"frontend":{"strategy":"launcher_dir"},"game_data":{"base":"scripts","strategy":"relative_to","suffix":"gamedata"},"launcher_directory":{"of":"game_data","strategy":"parent"},"portmaster_core":{"candidates":["/opt/system/Tools/PortMaster","/opt/tools/PortMaster","/userdata/system/.local/share/PortMaster","/mnt/SDCARD/Apps/PortMaster/PortMaster","/mnt/mmc/MUOS/PortMaster","/mnt/sdcard/Roms/.portmaster/PortMaster","/mnt/sdcard/roms/ports/PortMaster","/sdcard/roms/ports/PortMaster"],"expected_type":"directory","on_missing":"unresolved","strategy":"first_existing"},"scripts":{"strategy":"launcher_dir"},"shell_directory":{"of":"game_data","strategy":"parent"}},"platform_id":"generic","preserved_dirs":["libs","config","themes","logs","cache"],"python":{"imports":["sys","encodings","zipfile","hashlib"],"mode":"system"},"required_adapters":["predicate.v1","path.v1","frontend.v1","library.v1","python.v1"],"schema_version":1,"source_route":"official","support":{"device_class":"unsupported-known","target_confirmation":"existing_core_or_override"}}
