{"capabilities":{"cleanup_appledouble":true,"install_apps":true,"install_portmaster":true,"install_ports":true,"inventory_apps":true,"inventory_ports":true,"leftovers":true,"manage_apps":true,"manage_artwork":true,"manage_frontend":true,"manage_images":true,"manage_portmaster":true,"manage_ports":true,"repair_runtimes":true,"scan_script_images":false,"trash":true,"update_portmaster":true},"config_version":"1.0.0","device_manufacturer":"TrimUI","display":{"default_height":720,"default_width":1280},"display_name":"TrimUI","environment_scopes":["love_ui"],"format":"jenny92.appmanager-config","frontend":{"control_source":"trimui/control.txt","core_executable":null,"core_launcher_source":null,"empty_tasksetter":true,"frontend_executable":"launch.sh","install_map":[{"executable":true,"source":"trimui/PortMaster.txt","target":"launch.sh"},{"executable":false,"source":"trimui/config.json","target":"config.json"},{"executable":false,"source":"trimui/icon.png","target":"icon.png"}],"kind":"trimui","management":"app","names":["launch.sh","config.json","icon.png"],"primary":"launch.sh","remove_core_launcher":true,"transforms":[{"kind":"export_library_group","library_group":"sdl2","target":"launch.sh","variable":"PYSDL2_DLL_PATH"}]},"health":[{"kind":"required_file","path":"{portmaster_core}/control.txt"},{"kind":"required_file","path":"{portmaster_core}/device_info.txt"},{"kind":"required_file","path":"{portmaster_core}/funcs.txt"},{"kind":"one_of_files","paths":["{portmaster_core}/pugwash","{portmaster_core}/harbourmaster"]},{"archive":"{portmaster_core}/pylibs.zip","directory":"{portmaster_core}/pylibs","kind":"archive_or_nonempty_directory"},{"imports":["sys","encodings","zipfile","hashlib"],"kind":"python_imports_or_runtime"}],"input":{"analog_sticks":2,"tty":"/dev/tty0"},"libraries":{"groups":{"gles":{"candidates":["/usr/lib"],"required_sonames":["libGLESv2.so"]},"sdl2":{"candidates":["/usr/lib","/usr/trimui/lib"],"required_sonames":["libSDL2-2.0.so.0","libSDL2_image-2.0.so.0","libSDL2_mixer-2.0.so.0","libSDL2_ttf-2.0.so.0"]}}},"locations":[{"formats":["port"],"id":"ports-scripts","kind":"port_scripts","path":"scripts","priority":100,"roles":["inventory","install","manage","trash","trash_restore","cleanup_apple_double"]},{"formats":["port"],"id":"ports-data","kind":"port_data","path":"game_data","priority":100,"roles":["inventory","install","manage","trash","trash_restore","cleanup_apple_double"]},{"formats":[],"id":"ports-images","kind":"port_images","path":"images","priority":100,"roles":["inventory","manage","trash","trash_restore","cleanup_apple_double"]},{"formats":["trimui_app"],"id":"apps-primary","kind":"apps","path":"apps","priority":100,"roles":["inventory","install","manage","trash","trash_restore","cleanup_apple_double"]}],"models":[{"display":{"default_height":768,"default_width":1024},"display_name":"TrimUI Brick","id":"brick","overrides":{"input":{"analog_sticks":0}},"priority":100,"recognition":{"case_insensitive":true,"kind":"env_equals","name":"DEVICE","value":"brick"}},{"display":{"default_height":768,"default_width":1024},"display_name":"TrimUI Brick Pro","id":"brick_pro","overrides":{"input":{"analog_sticks":2}},"priority":100,"recognition":{"case_insensitive":true,"kind":"env_equals","name":"DEVICE","value":"brick-pro"}},{"display":{"default_height":720,"default_width":1280},"display_name":"TrimUI Smart Pro","id":"smart_pro","overrides":{"input":{"analog_sticks":2}},"priority":100,"recognition":{"case_insensitive":true,"kind":"env_equals","name":"DEVICE","value":"smart-pro"}}],"paths":{"apps":{"strategy":"literal","value":"/mnt/SDCARD/Apps"},"frontend":{"strategy":"literal","value":"/mnt/SDCARD/Apps/PortMaster"},"game_data":{"strategy":"literal","value":"/mnt/SDCARD/Data/ports"},"images":{"strategy":"literal","value":"/mnt/SDCARD/Imgs/PORTS"},"launcher_directory":{"strategy":"literal","value":"/mnt/SDCARD/Data"},"portmaster_core":{"strategy":"literal","value":"/mnt/SDCARD/Apps/PortMaster/PortMaster"},"scripts":{"strategy":"launcher_dir"}},"platform_id":"trimui","preserved_dirs":["libs","config","themes","logs","cache"],"python":{"imports":["sys","encodings","zipfile","hashlib"],"mode":"system"},"required_adapters":["predicate.v1","path.v1","frontend.v1","library.v1","python.v1"],"schema_version":1,"source_route":"official","support":{"device_class":"tested","target_confirmation":"detected"}}
