{"capabilities":{"cleanup_appledouble":true,"install_apps":false,"install_portmaster":true,"install_ports":true,"inventory_apps":false,"inventory_ports":true,"leftovers":true,"manage_apps":false,"manage_artwork":true,"manage_frontend":true,"manage_images":true,"manage_portmaster":true,"manage_ports":true,"repair_runtimes":true,"scan_script_images":true,"trash":true,"update_portmaster":true},"config_version":"1.0.0","device_manufacturer":"MiniLoong","display":{"default_height":720,"default_width":960},"display_name":"MiniLoong Pocket One (LoongOS)","environment_scopes":["love_ui"],"format":"jenny92.appmanager-config","frontend":{"control_source":null,"core_executable":"PortMaster.sh","core_launcher_source":null,"empty_tasksetter":false,"frontend_executable":"PortMaster.sh","install_map":[{"executable":true,"source":"miniloong/PortMaster.txt","target":"PortMaster.sh"}],"kind":"script-internal","management":"app","names":["PortMaster.sh"],"primary":"PortMaster.sh","remove_core_launcher":false},"health":[{"kind":"required_file","path":"{portmaster_core}/control.txt"},{"kind":"required_file","path":"{portmaster_core}/device_info.txt"},{"kind":"required_file","path":"{portmaster_core}/funcs.txt"},{"kind":"one_of_files","paths":["{portmaster_core}/pugwash","{portmaster_core}/harbourmaster"]},{"kind":"executable_file","path":"{portmaster_core}/PortMaster.sh"},{"archive":"{portmaster_core}/pylibs.zip","directory":"{portmaster_core}/pylibs","kind":"archive_or_nonempty_directory"},{"imports":["sys","encodings","zipfile","hashlib"],"kind":"python_imports_or_runtime","runtime":"python_3.11"}],"input":{"analog_sticks":2,"tty":"/dev/tty0"},"libraries":{"groups":{"gles":{"candidates":["/usr/lib"],"required_sonames":["libGLESv2.so"]},"sdl2":{"candidates":["/usr/lib"],"required_sonames":["libSDL2-2.0.so.0","libSDL2_image-2.0.so.0","libSDL2_mixer-2.0.so.0","libSDL2_ttf-2.0.so.0"]}}},"locations":[{"formats":["port"],"id":"ports-scripts","kind":"port_scripts","path":"scripts","priority":100,"roles":["inventory","install","manage","trash","trash_restore","cleanup_apple_double"]},{"formats":["port"],"id":"ports-data","kind":"port_data","path":"game_data","priority":100,"roles":["inventory","install","manage","trash","trash_restore","cleanup_apple_double"]},{"formats":[],"id":"ports-images","kind":"port_images","path":"images","priority":100,"roles":["inventory","manage","trash","trash_restore","cleanup_apple_double"]}],"paths":{"frontend":{"strategy":"launcher_dir"},"game_data":{"strategy":"literal","value":"/roms/ports"},"images":{"base":"scripts","strategy":"relative_to","suffix":"images"},"launcher_directory":{"strategy":"launcher_dir"},"portmaster_core":{"base":"game_data","canonicalize_existing":true,"strategy":"relative_to","suffix":"PortMaster"},"scripts":{"strategy":"launcher_dir"}},"platform_id":"miniloong-loongos","preserved_dirs":["libs","config","themes","logs","cache"],"python":{"mode":"runtime_mount","runtime":"python_3.11"},"required_adapters":["predicate.v1","path.v1","frontend.v1","library.v1","python.v1"],"schema_version":1,"source_route":"miniloong-custom","support":{"device_class":"tested","target_confirmation":"detected"}}
