{"capabilities":{"cleanup_appledouble":true,"install_apps":false,"install_portmaster":true,"install_ports":true,"inventory_apps":false,"inventory_ports":true,"leftovers":true,"manage_apps":false,"manage_artwork":false,"manage_frontend":true,"manage_images":false,"manage_portmaster":true,"manage_ports":true,"repair_runtimes":true,"scan_script_images":false,"trash":true,"update_portmaster":true},"config_version":"1.0.0","display":{"default_height":480,"default_width":640},"display_name":"muOS","environment_scopes":["love_ui"],"format":"jenny92.appmanager-config","frontend":{"control_source":"muos/control.txt","core_executable":"PortMaster.sh","core_launcher_source":"muos/PortMaster.txt","empty_tasksetter":true,"frontend_executable":null,"install_map":[{"executable":false,"source":"muos/control.txt","target":"control.txt"}],"kind":"control-internal","management":"app","names":["control.txt"],"primary":"control.txt","remove_core_launcher":false},"health":[{"kind":"required_file","path":"{portmaster_core}/control.txt"},{"kind":"required_file","path":"{portmaster_core}/funcs.txt"},{"kind":"one_of_files","paths":["{portmaster_core}/pugwash","{portmaster_core}/harbourmaster"]},{"kind":"executable_file","path":"{portmaster_core}/PortMaster.sh"},{"archive":"{portmaster_core}/pylibs.zip","directory":"{portmaster_core}/pylibs","kind":"archive_or_nonempty_directory"}],"input":{"analog_sticks":2,"tty":"/dev/tty0"},"libraries":{"groups":{"gles":{"candidates":["/usr/lib","/lib"],"required_sonames":["libGLESv2.so"]},"system_sdl2":{"candidates":["/usr/lib","/lib"],"required_sonames":["libSDL2-2.0.so.0","libSDL2_image-2.0.so.0","libSDL2_mixer-2.0.so.0","libSDL2_ttf-2.0.so.0"]}}},"locations":[{"formats":["port"],"id":"ports-scripts","kind":"port_scripts","path":"scripts","priority":100,"roles":["inventory","install","manage","trash","trash_restore","cleanup_apple_double"]},{"formats":["port"],"id":"ports-data","kind":"port_data","path":"game_data","priority":100,"roles":["inventory","install","manage","trash","trash_restore","cleanup_apple_double"]}],"paths":{"frontend":{"strategy":"literal","value":"/roms/ports/PortMaster"},"game_data":{"fallback":["/mnt/mmc/ports"],"matched":"/mnt/sdcard/ports","prefix":"/mnt/sdcard","strategy":"literal_by_launcher_prefix"},"launcher_directory":{"of":"game_data","strategy":"parent"},"portmaster_core":{"strategy":"literal","value":"/mnt/mmc/MUOS/PortMaster"},"scripts":{"strategy":"launcher_dir"}},"platform_id":"muos","preserved_dirs":["libs","config","themes","logs","cache"],"python":{"imports":["sys","encodings","zipfile","hashlib"],"mode":"system"},"required_adapters":["predicate.v1","path.v1","frontend.v1","library.v1","python.v1"],"schema_version":1,"source_route":"official","support":{"device_class":"official-untested","target_confirmation":"detected"}}
